{
  "$schema": "https://json-schema.org/draft/2020-12/schema",
  "title": "edit_event",
  "description": "A teacher's review action on a question. C → B. ~/.chalkback/state/edits.jsonl, one per line. before/after are complete question objects (structure: see quiz.schema.json#/$defs/question). §5",
  "type": "object",
  "additionalProperties": false,
  "required": ["edit_id", "quiz_id", "q_id", "action", "before", "after", "at"],
  "properties": {
    "edit_id": {"type": "string", "minLength": 1},
    "quiz_id": {"type": "string", "pattern": "^Q-L-[A-Za-z0-9]+-\\d{8}-\\d{4}$"},
    "q_id": {"type": "string", "minLength": 1},
    "action": {"enum": ["edit", "delete", "approve", "reject"]},
    "before": {"type": "object"},
    "after": {"type": "object"},
    "at": {"type": "string", "pattern": "^\\d{4}-\\d{2}-\\d{2}T\\d{2}:\\d{2}:\\d{2}(\\.\\d+)?[+-]\\d{2}:\\d{2}$"}
  }
}
